cat_id,url_old,cat_name_old,age_old,gender_old,cafe_cat_old,kid_approved_old,dog_approved_old,companion_cat_old,bonded_pair_old,single_cat_old,type_old,description_old,system_import_at_old,url_new,cat_name_new,age_new,gender_new,cafe_cat_new,kid_approved_new,dog_approved_new,companion_cat_new,bonded_pair_new,single_cat_new,type_new,description_new,system_import_at_new,was_url_modified,was_cat_name_modified,was_age_modified,was_gender_modified,was_cafe_cat_modified,was_kid_approved_modified,was_dog_approved_modified,was_companion_cat_modified,was_bonded_pair_modified,was_single_cat_modified,was_type_modified,was_description_modified,was_modified,change_type
19014845,,,,,,,,,,,,,,https://catcafebk.com/our-cats/?cat=19014845,Pluto,"1 Year 7 Months "," Male",False,False,False,True,False,True,"Domestic Short Hair ","Pluto is a very sweet and active boy who is very curious to explore new spaces. He purrs quite a bit and likes to rub up against legs.  He is often amenable to being picked up and snuggled, while other times preferring more space (particularly in the evenings!). He likes to know what is happening and will follow you to the restroom and keep you company. He will often curl up at your feet or sit next to you on the couch if he sees you settled in one place. He likes to play but is not a fan of toys that make squeaky noises. He gets a bit startled by loud noises and quick movements, so a home without children may be best.",2023-02-27 22:49:46+00:00,True,True,True,True,True,True,True,True,True,True,True,True,True,row_added
19061857,,,,,,,,,,,,,,https://catcafebk.com/our-cats/?cat=19061857,Rambo,"1 Year 5 Months "," Male",False,False,False,True,False,True,"Domestic Short Hair ","Rambo has been the ideal work-from-home buddy who enjoys human companionship just as much as humans do. You will melt in his large, orange-yellow eyes that match the patches of orange on his fur. He’s a simple, low-maintenance dude who loves churus, cuddles, and chasing around string. On a given day he’s usually chilling in the afternoon with the occasional burst of energy to play for 30 minutes before bedtime. He doesn’t mind being carried and will cuddle and nap with you after a few minutes of petting his soft, chinchilla-like fur.",2023-02-27 22:49:46+00:00,True,True,True,True,True,True,True,True,True,True,True,True,True,row_added
19048801,,,,,,,,,,,,,,https://catcafebk.com/our-cats/?cat=19048801,Rikki & Sandy,"7 Months 4 Days "," Female",False,True,True,False,True,False,"Domestic Short Hair ","Sandy and Rikki are the sweetest pair. Sandy is curious, sweet, and playful. She is the first one to run at the sound of incoming meals, to jump at an empty lap, or pounce on a tantalizing toy. Rikki started off shy, but now she can't wait to be picked up and pet, even occasionally gently placing paws on your hands for better attention. Rikki may be little, but she's a powerful wrestler and an insistent cuddler. She also loves to follow you around even when her help isn't needed!",2023-02-27 22:49:46+00:00,True,True,True,True,True,True,True,True,True,True,True,True,True,row_added
18986800,,,,,,,,,,,,,,https://catcafebk.com/our-cats/?cat=18986800,Rita Wilde,"2 Years 3 Months "," Female",False,False,False,True,False,True,"Domestic Short Hair ","Rita is the sweetest little baby girl. She loves to play with toys and loves to juggle them around on her own. During the day when she’s sleepy, she likes to lounge on her cat tree and watch ‘cat TV’ out the window. When her foster wakes up in the morning and says her name, Rita will always zoom to the bed and greet her human with soft meows and purrs. Whenever she wants to play, she will walk in front of you and plop down and start rolling around on the floor in the cutest way possible. She’s also really kind towards visitors, greeting them with her cuteness and inviting them to play with her.",2023-02-27 22:49:46+00:00,True,True,True,True,True,True,True,True,True,True,True,True,True,row_added
19004882,,,,,,,,,,,,,,https://catcafebk.com/our-cats/?cat=19004882,Sativa,"2 Years 7 Months "," Female",False,False,True,False,False,False,"Domestic Short Hair ","Sativa is a small cat with a big attitude. She is adventurous and energetic and loves to explore, play, run, jump and climb. She sees everyone as a possible playmate: humans, other cats, and even big dogs. She'd do best in a home where she'll get plenty of playtime and enrichment and where animal housemates won't be overwhelmed by her playful energy. Sativa also has a snuggly side. Once she's tired out, she enjoys curling up for a nap. Sativa is looking for a new home after her previous owner lost his housing. She previously lived with other cats and with a large dog. Her sister Indica is also available for adoption, they can be adopted together or separately, as they are not bonded.",2023-02-27 22:49:46+00:00,True,True,True,True,True,True,True,True,True,True,True,True,True,row_added
19015699,,,,,,,,,,,,,,https://catcafebk.com/our-cats/?cat=19015699,Serena,," Female",False,False,False,False,False,False,"Domestic Short Hair ","Serena is a super sweet and playful calico girl. She loves pats and will purr like crazy, headbutt for more, and even roll over onto her back for belly scritches! She’s energetic and adores toys of all kinds (especially anything with feathers). She’s always up for interactive play with a wand toy, but also happy to play by herself with her catnip mouse. Serena can be a little shy at first, but is easily won over with scritches and treats. She’s still learning about laps and hasn’t figured out that she can crawl up herself, but in the meantime she’s happy to be placed there for snuggles. Her other hobbies include following her human around the house, watching the washing machine spin (she’s absolutely mesmerized), and rolling around cutely on the floor in hopes of getting pats. Serena is curious and friendly with other cats and needs to be adopted into a home with a playful companion — adoptions for her as a single cat will be ignored.",2023-02-27 22:49:46+00:00,True,True,False,True,True,True,True,True,True,True,True,True,True,row_added
19048789,,,,,,,,,,,,,,https://catcafebk.com/our-cats/?cat=19048789,Sipha,"2 Years 0 Months "," Female",False,False,False,True,False,True,"Domestic Short Hair ","Sipha loves nothing more than to be pet, and bonus points if she’s sitting in your lap while you do it. She’ll purr non-stop, offer you her chin, and give you loving headbutts. Sipha was likely someone’s pet at some point, but has been living on the streets for a while. She was being fed by a kind person and has had at least two litters. As a result, while she adores humans, she’s a wary cat and frightens easily at loud noises and sudden movements. Don’t worry about her disappearing under the bed for too long, however. Just offer her cuddles and she’ll come right back out. Sipha is a very chill cat (not a whole lot of zoomies to deal with) and would do better as your one-and-only pet in a household free of children.",2023-02-27 22:49:46+00:00,True,True,True,True,True,True,True,True,True,True,True,True,True,row_added
18989734,,,,,,,,,,,,,,https://catcafebk.com/our-cats/?cat=18989734,Sriracha & Sambal,"5 Months 23 Days ",,False,False,False,False,True,False,"Domestic Short Hair ","Sambal and Sriracha may have spicy names, but they are as sweet as can be. They are very attached and are always snuggling together. Sriracha (black and white) is adventurous and loves to play. She is always the first to check out a new space or toy while her brother watches from afar. Sambal (black) has ""grumpy old man"" energy with his love of warm spaces and long naps. He is very protective of his sister. These two will bring so much joy to your home, both from their love for each other and their pending love for you!",2023-02-27 22:49:46+00:00,True,True,True,False,True,True,True,True,True,True,True,True,True,row_added
18986903,,,,,,,,,,,,,,https://catcafebk.com/our-cats/?cat=18986903,Sunnydale High,"3 Years 0 Months "," Female",False,False,False,True,False,True,"Domestic Short Hair ","Sunnydale High is a super sweet and quiet ginger girl. She absolutely adores wand toys, treat tubes, as well as scritches on her forehead and in front of her ears. She can get spooked easily, but she’s getting braver as she gets more comfortable. She would do well with a patient adopter willing to go at her pace, especially since she appreciates her independence. Sunnydale is FIV+ and will live a normal, healthy life when provided with quality care such as a balanced diet and yearly wellness exams (like any cat). As FIV+ is not transmittable between neutered/spayed cats under normal circumstances, we are happy for FIV+ cats to mingle with FIV- cats in their adoptive homes.",2023-02-27 22:49:46+00:00,True,True,True,True,True,True,True,True,True,True,True,True,True,row_added
19062612,,,,,,,,,,,,,,https://catcafebk.com/our-cats/?cat=19062612,Temporary Shadow,"10 Months 26 Days "," Female",False,True,True,False,False,False,"Domestic Short Hair ","Temporary Shadow is an active and cuddly young cat. She loves to be pet around her head and will roll around her back to ask for belly rubs. She is very energetic and constantly playing, although she does occasionally take a quick break for a snooze. She is quick to adapt to new environments and would be happiest in a home with an age appropriate feline friend.",2023-02-27 22:49:46+00:00,True,True,True,True,True,True,True,True,True,True,True,True,True,row_added
19015676,,,,,,,,,,,,,,https://catcafebk.com/our-cats/?cat=19015676,Thumbs Up & Stuart,"5 Months 17 Days "," Male",False,True,True,False,True,False,"Domestic Short Hair ","These two purr-machines are the sweetest guys you’ll ever meet. They are always seen snuggled up to each other in the kitty bed grooming each other. Stuart is a total lover. As soon as you get near him, he purrs loudly and rubs up against you for snuggles. This pirate kitty always wants to play and hop up on laps for cuddles.  Thumbs Up is a bit more cautious than his BFF – while the first to explore, he takes his time to get to know you more snuggling in. His extra thumbs come in handy for playing with Stuart.",2023-02-27 22:49:46+00:00,True,True,True,True,True,True,True,True,True,True,True,True,True,row_added
19060906,,,,,,,,,,,,,,https://catcafebk.com/our-cats/?cat=19060906,Toil,"1 Year 8 Months "," Female",True,True,True,False,False,False,"Domestic Short Hair ","Oh, how we love this lady! Sweet Toil has been a cafe resident for over a year and we have no idea how she hasn't been snatched up! She is gentle and affectionate and gets along well with other cats and would love a home with a feline friend.",2023-02-27 22:49:46+00:00,True,True,True,True,True,True,True,True,True,True,True,True,True,row_added
19006297,,,,,,,,,,,,,,https://catcafebk.com/our-cats/?cat=19006297,Toothless,"5 Years 3 Months "," Male",False,False,False,True,False,True,"Domestic Short Hair ","Toothless was a popular fixture on his Flatbush block and was fed daily by a resident caretaker until the building super became hostile to him. After going to foster he got a full mouth extraction due to severe dental disease, but he still enjoys dry food and loves Temptations. Toothless didn’t always have positive encounters with humans on the street and sometimes he can still have defensive instincts, but he has become very affectionate and loves being petted. He is also extremely playful. He loves string toys and he never tires of his plastic tiered rolling ball toy. He has exhibited some bullying behavior with mellow female cats, but could possibly find a playmate with a high-spirited male that matches his energy.",2023-02-27 22:49:46+00:00,True,True,True,True,True,True,True,True,True,True,True,True,True,row_added
19014862,,,,,,,,,,,,,,https://catcafebk.com/our-cats/?cat=19014862,Whitley,"4 Months 25 Days "," Female",False,False,False,True,False,True,"Domestic Short Hair ","Whitley is a very sweet and friendly feline. With a calm demeanor and gentle nature, Whitley is perfect for those seeking a more independently minded companion. She is comfortable with being picked up in your arms and she loves receiving head and chin scratches. Whitley is currently on a wet food diet as she is showing symptoms which may be related to kidney disease. While tolerant of other cats, she prefers an area she can call her own.",2023-02-27 22:49:46+00:00,True,True,True,True,True,True,True,True,True,True,True,True,True,row_added
19047320,,,,,,,,,,,,,,https://catcafebk.com/our-cats/?cat=19047320,Winding Road & Turbo,"6 Months 6 Days "," Male",True,True,True,False,True,False,"Domestic Short Hair ","Turbo and Winding Road are an entertaining and ridiculous pair. Turbo is definitely the brains of the operation and will often send his buddy out to investigate new situations. Winding Road is obsessed with playing and really, really bad at hide and seek. These besties are good with other cats and would be happy with kids or dogs.",2023-02-27 22:49:46+00:00,True,True,True,True,True,True,True,True,True,True,True,True,True,row_added
18989033,,,,,,,,,,,,,,https://catcafebk.com/our-cats/?cat=18989033,Yoda,"7 Years 2 Months "," Male",False,True,False,True,False,True,"Domestic Short Hair ","Yoda is the most snuggly lap cat one could ask for. This friendly boy is a gentle giant who will crawl onto your lap or chest and make himself at home. He loves chin scritches, belly rubs, and being held like a baby, spooned, cradled, petted…you name it. He also loves to lick humans, and will lick your hand / arm / face if you let him. Since he is so social, he will be happiest in a home with people who are able to give him the attention he seeks and who either work from home or have a flexible schedule and won’t leave him alone for extended periods of time over multiple days. Yoda is a lowkey cat, who spends most of the day napping in a quiet spot. He lives up to his name, and really does look like a version of baby Yoda with his wide-set ears and sleepy eyes. He’s not a picky eater and gets chatty when he’s hungry and will tell you he wants food with his sweet meow! He likes to play with wand toys. At night he sleeps on the foot of the bed or will climb up and curl up into a body nook. He is not a fan of closed doors. Yoda does have some health issues that we are getting under control and we'd be happy to talk more about what this sweet guy needs to get healthy.",2023-02-27 22:49:46+00:00,True,True,True,True,True,True,True,True,True,True,True,True,True,row_added
18986799,https://catcafebk.com/our-cats/?cat=18986799,Alex the Pirate,"2 Years 3 Months "," Male",False,True,False,True,False,True,"Domestic Short Hair ","Alex the Pirate wants one thing only: all the pets he can get. This gentle, soft-spoken boy will emerge from his hiding place if he senses the possibility of a head scratch or a tummy rub. If he wants more, he’ll make sure to let you know with headbutt after headbutt. When he’s satisfied, he’ll make endless biscuits — this boy could open a factory! Alex is a gentle soul. He has a persistent respiratory condition that makes his breathing wheezy and is a big snorer, but on the upside, he has amplified purrs!",2023-02-27 22:49:46+00:00,,,,,,,,,,,,,,True,True,True,True,True,True,True,True,True,True,True,True,True,row_deleted
18949086,https://catcafebk.com/our-cats/?cat=18949086,Bada & Pow,"5 Months 24 Days "," Male",False,True,True,False,True,False,"Domestic Short Hair ","Bada and Pow are two adorable, playful brothers. They absolutely love to explore and play with anything and everything. Bada is more cautious and shy and is a sweet sweet soul, while Pow is the explorer and adventurer. Pow does a great job at getting Bada out of his shell and the two can often be found wrestling and chasing one another around the apartment. When not busy exploring, they love pets and cuddles with their humans.",2023-02-27 22:49:46+00:00,,,,,,,,,,,,,,True,True,True,True,True,True,True,True,True,True,True,True,True,row_deleted
19015693,https://catcafebk.com/our-cats/?cat=19015693,Bella & Clara,"7 Months 14 Days "," Female",False,False,False,False,True,False,"Domestic Short Hair ","Bella and Clara are the sweetest bonded sisters who love curling up together, playing with wand toys, wrestling and exploring every inch of the apartment. Bella is a purr machine and adores attention. She can’t get enough morning pets, night time snuggles and really any opportunity to hang. Clara’s love language is quieter, but once you snuggle her in a blanket or towel, she’s in her happy place. She lives for some behind the ear scratches. Together they are quite a special pair.",2023-02-27 22:49:46+00:00,,,,,,,,,,,,,,True,True,True,True,True,True,True,True,True,True,True,True,True,row_deleted
19048828,https://catcafebk.com/our-cats/?cat=19048828,Benjiro,"1 Year 1 Month "," Male",False,False,False,False,False,False,"Domestic Short Hair ","Benjiro is a sweet and relaxed black panther who loves belly rubs. His favorite pastimes are napping in the sun (or your lap), scratching at the scratching post (you won’t have issues with your couches with Benjiro!), and eating treats. He loves soft toys and will carry them around in his mouth. He is an incredibly polite cat — while he likes company, he is never obtrusive about attention. He's loyal yet not clingy. Benjiro has fallen in love with the resident cat at his foster home and is looking for a home with a confident, friendly cat looking for a sidekick.",2023-02-27 22:49:46+00:00,,,,,,,,,,,,,,True,True,True,True,True,True,True,True,True,True,True,True,True,row_deleted
19014973,https://catcafebk.com/our-cats/?cat=19014973,Bing & Bang,"5 Months 5 Days ",,True,True,True,False,True,False,"Domestic Short Hair ","This gorgeous brother and sister love each other completely. They play continuously and love cuddling up together or with their humans during naps. Bang’s sweet face will make you melt. He loves to lay next to you and get head rubs and pets, rewarding you with non-stop purrs. While more reserved than his sister, her bravery rubs off and helps him out of his shell. Bing is charming and extremely affectionate ways. She loves to lay on your chest, cuddle and give kisses while you watch TV. Bing goes crazy for treats and Bang will patiently wait for his sister to be done to get his turn. She’ll also happily jump into your lap and demand cuddles. They’re super gentle with school age children, other cats and small dogs.",2023-02-27 22:49:46+00:00,,,,,,,,,,,,,,True,True,True,False,True,True,True,True,True,True,True,True,True,row_deleted
19061854,https://catcafebk.com/our-cats/?cat=19061854,Blithedale & Carbuncle,"8 Months 28 Days "," Female",False,True,True,False,True,False,"Domestic Short Hair ","Blithedale Romance is a charming and snuggly calico. She is full of energy for play time and then is ready for a cuddle — she will let you pick her up, she may sleep on your legs or up against you. The Great Carbuncle is a bit more cautious and protective than her counterpart, but once you get through that thin layer of sass she’s just like her purring machine sister and melts into a love bug. She loves a donut bed and other cats.",2023-02-27 22:49:46+00:00,,,,,,,,,,,,,,True,True,True,True,True,True,True,True,True,True,True,True,True,row_deleted
18948728,https://catcafebk.com/our-cats/?cat=18948728,Bluto & Popeye,"7 Months 5 Days ",,False,False,False,False,True,False,"Domestic Short Hair ","Popeye and Bluto are a beautiful bonded sibling pair. Popeye is a playful and friendly male in a dapper tuxedo. He is very friendly and playful and purrs instantly when you scratch his neck. Bluto is petite with a gorgeous tortoiseshell coat. She is still working on being as brave as her brother, but treats will quickly win her over and she is quick to purr when held. Bluto has come a long way and will definitely continue to come out of her shell with patience and snacks. This sweet pair would do best in a patient and quiet household without children.",2023-02-27 22:49:46+00:00,,,,,,,,,,,,,,True,True,True,False,True,True,True,True,True,True,True,True,True,row_deleted
17834315,https://catcafebk.com/our-cats/?cat=17834315,Bobsled,"2 Years 11 Months "," Male",False,True,False,True,False,True,"Domestic Short Hair ","Bobsled is a kind and quirky tuxedo who loves to follow you around while headbutting your legs and purring. This social guy will hang with you as you work from home or cook in the evening. He enjoys pets on the chin, behind the ears and on his back and very much appreciates scritches near the tail. He is happy as a single cat, but also does very well with a companion.",2023-02-27 22:49:46+00:00,,,,,,,,,,,,,,True,True,True,True,True,True,True,True,True,True,True,True,True,row_deleted
18986895,https://catcafebk.com/our-cats/?cat=18986895,Broomstick & Candelabra,"6 Months 25 Days "," Male",False,True,True,False,True,False,"Domestic Short Hair ","Are you looking for playful, snuggly, silly kittens? If so, these sweet boys might be your perfect match! Although they can be a little skittish while settling into a new place, Broomstick and Candelabra will transform into rambunctious, snuggly little furbabies as soon as they’re comfortable. Candelabra has earned the nickname “Lawnmower” with his foster family due to how loudly he purrs. He’s also not afraid to speak up, and he will let you know with his squeaky little mew when it’s time to play or give him snuggles (which is often!). At night, once he’s gotten his zoomies out with his brother, he likes to settle in for some snuggles on his foster mom’s legs. Broomstick is a little more shy, but if you’re patient (and generous with Churus, his favorite treats) he’ll be happy to play and accept some pets from you. These boys absolutely adore one another, and it’s so fun to watch them play and snuggle, and so gratifying to be let in on the fun once you’ve earned their trust!",2023-02-27 22:49:46+00:00,,,,,,,,,,,,,,True,True,True,True,True,True,True,True,True,True,True,True,True,row_deleted
18578528,https://catcafebk.com/our-cats/?cat=18578528,Butterhead & Mesclun,"9 Months 22 Days "," Female",False,True,True,False,True,False,"Domestic Short Hair ","Mesclun and Butterhead are two active sisters who love to wrestle and zoom around the home. After play time, you can catch them snuggling up for a nap in the sun. Butterhead (black & white) will happily greet you at the door after a long day of work. She’ll then bribe you for scritches by stretching out on the floor and flashing her cutest poses. Butterhead can keep herself entertained for hours with a turntable ball toy and plush toys. Don’t mind if Butterhead joins you on a Netflix binge — she particularly enjoys watching football and nature documentaries. Mesclun is a bit more on the mellow side, but that doesn’t stop her sweet personality from shining. She is very curious, so she can typically be found in a box or paperbag that you have lying around. Her favorite activity is chasing a laser toy around the home and finding the best cuddle spots.",2023-02-27 22:49:46+00:00,https://catcafebk.com/our-cats/?cat=18578528,Butterhead & Mesclun,"1 Year 2 Months "," Female",False,True,True,False,True,False,"Domestic Short Hair ","Mesclun and Butterhead are two active sisters who love to wrestle and zoom around the home. After play time, you can catch them snuggling up for a nap in the sun. Butterhead (black & white) will happily greet you at the door after a long day of work. She’ll then bribe you for scritches by stretching out on the floor and flashing her cutest poses. Butterhead can keep herself entertained for hours with a turntable ball toy and plush toys. Don’t mind if Butterhead joins you on a Netflix binge — she particularly enjoys watching football and nature documentaries. Mesclun is a bit more on the mellow side, but that doesn’t stop her sweet personality from shining. She is very curious, so she can typically be found in a box or paperbag that you have lying around. Her favorite activity is chasing a laser toy around the home and finding the best cuddle spots.",2023-07-08 17:08:34+00:00,False,False,True,False,False,False,False,False,False,False,False,False,True,row_modified
19047168,https://catcafebk.com/our-cats/?cat=19047168,Capitan,"2 Years 0 Months "," Male",True,False,False,True,False,True,"Domestic Short Hair ","Have no fear, the Capitan is here and ready for chin scratches and belly pats! This very vocal mate loves patrolling the room and standing directly in front of you for pets. He has been known to lay atop of important documents and block Netflix shows. He is a very active and playful and loves pouncing on objects and demonstrating his prey skills. Finding Capitan after work is a delight, for he will always meet you meowing and asking for pets.",2023-02-27 22:49:46+00:00,,,,,,,,,,,,,,True,True,True,True,True,True,True,True,True,True,True,True,True,row_deleted
