cat_id,url_old,cat_name_old,age_old,gender_old,cafe_cat_old,kid_approved_old,dog_approved_old,companion_cat_old,bonded_pair_old,single_cat_old,type_old,description_old,system_import_at_old,url_new,cat_name_new,age_new,gender_new,cafe_cat_new,kid_approved_new,dog_approved_new,companion_cat_new,bonded_pair_new,single_cat_new,type_new,description_new,system_import_at_new,was_url_modified,was_cat_name_modified,was_age_modified,was_gender_modified,was_cafe_cat_modified,was_kid_approved_modified,was_dog_approved_modified,was_companion_cat_modified,was_bonded_pair_modified,was_single_cat_modified,was_type_modified,was_description_modified,was_modified,change_type
17952492,https://catcafebk.com/our-cats/?cat=17952492,Papa Watkins Riverdale,"10 Years 0 Months "," Male",False,False,False,True,False,True,"Domestic Short Hair ","Sometimes the best things are worth the wait – and sweet Papa Watkins is a great example. Sick and scared when he first went to foster, this guy slowly and surely became healthier and started to blossom into a more confident companion. He now LOVES head pets and scritches and seeks out attention from his foster parents, no longer running and hiding when he’s scared.. Papa Watkins is a champion napper and eater and will never say no to a pet or treat. He loves to chase balls around the apartment and he’s developed an adorable tendency to drool when he’s super content. His newest way of asking for attention is to lay down at your feet, placing a paw or his head directly on your foot just to say he’s there. This sweetheart needs a home where his new family can spoil him with love and attention. Papa Watkins had been living in a slightly managed outdoor colony for a couple of years, but was always too busy fighting or hanging with the lady cats to go into a trap, until one bitter cold night when he was scavenging through recycling and hungry enough to get rescued. Papa Watkins is FIV+ and will live a normal, healthy life when provided with quality care such as a balanced diet and yearly wellness exams (like any cat). As FIV+ is not transmittable between neutered/spayed cats under normal circumstances, we are happy for FIV+ cats to mingle with FIV- cats in their adoptive homes.",2023-02-27 22:49:46+00:00,,,,,,,,,,,,,,True,True,True,True,True,True,True,True,True,True,True,True,True,row_deleted
18950699,https://catcafebk.com/our-cats/?cat=18950699,Parfum,"8 Years 2 Months "," Male",False,True,False,True,False,True,"Domestic Short Hair ","Parfum is the sweetest cat and all he wants is to be loved! He started having full conversations with his foster on his drive home and hasn’t stopped since. This oh so sweet boy loves belly rubs (his sweet spot), chin scritches and being held like a baby and is so affectionate he doesn’t mind being smothered in kisses. He will get into your lap every once in a while, but most of the time he is glad to just be by your side, especially when sleeping. He is a very active and busy biscuit maker and spends the rest of his time meowing for attention, asking for treats or snoozing in a comfy spot. Parfum is in need of dental surgery.",2023-02-27 22:49:46+00:00,https://catcafebk.com/our-cats/?cat=18950699,Parfum,"8 Years 6 Months "," Male",False,True,False,True,False,True,"Domestic Short Hair ","Parfum is the sweetest cat and all he wants is to be loved! He started having full conversations with his foster on his drive home and hasn’t stopped since. This oh so sweet boy loves belly rubs (his sweet spot), chin scritches and being held like a baby and is so affectionate he doesn’t mind being smothered in kisses. He will get into your lap every once in a while, but most of the time he is glad to just be by your side, especially when sleeping. He is a very active and busy biscuit maker and spends the rest of his time meowing for attention, asking for treats or snoozing in a comfy spot. Parfum is in need of dental surgery.",2023-07-08 17:08:34+00:00,False,False,True,False,False,False,False,False,False,False,False,False,True,row_modified
18435719,https://catcafebk.com/our-cats/?cat=18435719,Paste & Undo,"10 Months 15 Days "," Male",True,True,True,False,True,False,"Domestic Short Hair ","Undo and Paste are a pair of lively and sweet brothers. These two initially shy boys have become quite snuggly and vocal as their appetites and demands continue to grow. They both very much enjoy surrounding themselves with toys and stalking and pouncing on each other through a kitty tunnel. These boys enjoy pets, scritches, and belly rubs. They have begun to socialize and love to follow around the resident cats. Undo and Paste enjoy snuggling and giving kisses to their foster parents, especially first thing in the morning - you can tell they are happy to see you. These heartbreakers are adorable and fun and so playful - a constant heart explosion.",2023-02-27 22:49:46+00:00,,,,,,,,,,,,,,True,True,True,True,True,True,True,True,True,True,True,True,True,row_deleted
17539613,https://catcafebk.com/our-cats/?cat=17539613,Petra & Paula,"1 Year 9 Months "," Female",False,True,False,False,True,False,"Domestic Short Hair (short coat) ","Petra and Paula are nearly identical 6 month old tuxedo sisters! They were rescued with a third sibling in the Sheepshead Bay area, where these three kittens were trying to survive in the back of a medical office, hiding under the porch. They are healthy, playful and moderately active. They both love to be around people and to play with each other and other cats. They are spayed, free from parasites, , vaccinated, tested negative for FIV/FeLV and microchipped. Petra and Paula must be adopted together. They are being fostered in Midwood and their rescuer can arrange either a video or in person meeting. *Courtesy Posting: This cat is being independently offered for adoption by a rescuer who is not a representative of BBAWC or Brooklyn Cat Cafe. The rescuer offering this cat is responsible for the content of this post and any medical records and vaccines. BBAWC and Brooklyn Cat Cafe cannot vouch for any information in this post. An adoption fee will be charged by the rescuer.",2023-02-27 22:49:46+00:00,https://catcafebk.com/our-cats/?cat=17539613,Petra & Paula,"2 Years 1 Month "," Female",False,True,False,False,True,False,"Domestic Short Hair (short coat) ","Petra and Paula are nearly identical tuxedo sisters! They were rescued with a third sibling in the Sheepshead Bay area, where these three kittens were trying to survive in the back of a medical office, hiding under the porch. They are healthy, playful and moderately active. They both love to be around people and to play with each other and other cats. They are spayed, free from parasites, , vaccinated, tested negative for FIV/FeLV and microchipped. Petra and Paula must be adopted together. They are being fostered in Midwood and their rescuer can arrange either a video or in person meeting. *Courtesy Posting: This cat is being independently offered for adoption by a rescuer who is not a representative of BBAWC or Brooklyn Cat Cafe. The rescuer offering this cat is responsible for the content of this post and any medical records and vaccines. BBAWC and Brooklyn Cat Cafe cannot vouch for any information in this post. An adoption fee will be charged by the rescuer.",2023-07-08 17:08:34+00:00,False,False,True,False,False,False,False,False,False,False,False,True,True,row_modified
19014845,https://catcafebk.com/our-cats/?cat=19014845,Pluto,"1 Year 7 Months "," Male",False,False,False,True,False,True,"Domestic Short Hair ","Pluto is a very sweet and active boy who is very curious to explore new spaces. He purrs quite a bit and likes to rub up against legs.  He is often amenable to being picked up and snuggled, while other times preferring more space (particularly in the evenings!). He likes to know what is happening and will follow you to the restroom and keep you company. He will often curl up at your feet or sit next to you on the couch if he sees you settled in one place. He likes to play but is not a fan of toys that make squeaky noises. He gets a bit startled by loud noises and quick movements, so a home without children may be best.",2023-02-27 22:49:46+00:00,,,,,,,,,,,,,,True,True,True,True,True,True,True,True,True,True,True,True,True,row_deleted
18928047,https://catcafebk.com/our-cats/?cat=18928047,Princey,"9 Years 2 Months "," Male",False,True,True,True,False,True,"Domestic Short Hair ","Princey is a very affectionate cat and loves to cuddle up any time of the day. He expresses his wonderful vocals at night, and it is the most adorable sound you will ever hear! He is shy at first, but he does not hide. He loves pets and scratches on his head and warms up in a couple hours. Even though he is not very energetic, he has loads of curiosity. Whenever a door opens, he is the first one to hear it and will investigate immediately. He loves to stare out the window at night and check out what is going on and will cuddle up next to you as long as you pet him. His love language is definitely physical touch and he makes the perfect work companion.",2023-02-27 22:49:46+00:00,,,,,,,,,,,,,,True,True,True,True,True,True,True,True,True,True,True,True,True,row_deleted
18849368,https://catcafebk.com/our-cats/?cat=18849368,Quip & Remsen,"7 Months 11 Days ",,False,False,True,False,True,False,"Domestic Short Hair ","Quip is a high-energy firecracker. She is inquisitive, athletic, and will chase any toy you throw at her. Expect a nightly case of the zoomies and overall playfulness that will keep you enchanted. She definitely requires a keen eye, as she’s known to get into trouble and has a feisty side. When she’s not in daredevil mode, she is absurdly affectionate. She will climb all over you in the middle of your work, sleep, whenever. She loves to make biscuits and curl up on people’s necks, so expect a good cuddling when she’s tired out. Bonus: she feels like a cloud, will the softest, prettiest fur ever. She can be a bit rough when playing with other cats, so make sure you watch her carefully and can deter any aggressiveness. Remsen is more reserved than his BFF, but definitely has some of that kitten energy. He is super affectionate but may take longer to open up. His face resembles a mini tiger, and he has a gorgeous, thick, and warm tabby coat. Remsen is a little genius cat, who loves finding hidden treats and discovering whatever climbing spots you have. He adores treats andhis favorite time is meal-time. In between waiting for dinner and lunch, he's typically cozied up on a pillow or next to the window watching TV or people.",2023-02-27 22:49:46+00:00,https://catcafebk.com/our-cats/?cat=18849368,Quip & Remsen,"11 Months 22 Days ",,False,False,True,False,True,False,"Domestic Short Hair ","Quip is a high-energy firecracker. She is inquisitive, athletic, and will chase any toy you throw at her. Expect a nightly case of the zoomies and overall playfulness that will keep you enchanted. She definitely requires a keen eye, as she’s known to get into trouble and has a feisty side. When she’s not in daredevil mode, she is absurdly affectionate. She will climb all over you in the middle of your work, sleep, whenever. She loves to make biscuits and curl up on people’s necks, so expect a good cuddling when she’s tired out. Bonus: she feels like a cloud, will the softest, prettiest fur ever. She can be a bit rough when playing with other cats, so make sure you watch her carefully and can deter any aggressiveness. Remsen is more reserved than his BFF, but definitely has some of that kitten energy. He is super affectionate but may take longer to open up. His face resembles a mini tiger, and he has a gorgeous, thick, and warm tabby coat. Remsen is a little genius cat, who loves finding hidden treats and discovering whatever climbing spots you have. He adores treats andhis favorite time is meal-time. In between waiting for dinner and lunch, he's typically cozied up on a pillow or next to the window watching TV or people.",2023-07-08 17:08:34+00:00,False,False,True,False,False,False,False,False,False,False,False,False,True,row_modified
19061857,https://catcafebk.com/our-cats/?cat=19061857,Rambo,"1 Year 5 Months "," Male",False,False,False,True,False,True,"Domestic Short Hair ","Rambo has been the ideal work-from-home buddy who enjoys human companionship just as much as humans do. You will melt in his large, orange-yellow eyes that match the patches of orange on his fur. He’s a simple, low-maintenance dude who loves churus, cuddles, and chasing around string. On a given day he’s usually chilling in the afternoon with the occasional burst of energy to play for 30 minutes before bedtime. He doesn’t mind being carried and will cuddle and nap with you after a few minutes of petting his soft, chinchilla-like fur.",2023-02-27 22:49:46+00:00,,,,,,,,,,,,,,True,True,True,True,True,True,True,True,True,True,True,True,True,row_deleted
18948885,https://catcafebk.com/our-cats/?cat=18948885,Ray & Egon,"5 Months 29 Days ",,True,True,True,False,True,False,"Domestic Short Hair ","Ray and Egon are two adorable lap cats. Ray (tuxedo) loves sleeping on his foster lap and curling up next to his foster dad. His purr motor is always on. Egon (brown tabby) is a bit shyer, but loves to play. These two kittens love to run around, chase laser dots and keeping their fosters safe from the blanket monster.",2023-02-27 22:49:46+00:00,,,,,,,,,,,,,,True,True,True,False,True,True,True,True,True,True,True,True,True,row_deleted
19048801,https://catcafebk.com/our-cats/?cat=19048801,Rikki & Sandy,"7 Months 4 Days "," Female",False,True,True,False,True,False,"Domestic Short Hair ","Sandy and Rikki are the sweetest pair. Sandy is curious, sweet, and playful. She is the first one to run at the sound of incoming meals, to jump at an empty lap, or pounce on a tantalizing toy. Rikki started off shy, but now she can't wait to be picked up and pet, even occasionally gently placing paws on your hands for better attention. Rikki may be little, but she's a powerful wrestler and an insistent cuddler. She also loves to follow you around even when her help isn't needed!",2023-02-27 22:49:46+00:00,,,,,,,,,,,,,,True,True,True,True,True,True,True,True,True,True,True,True,True,row_deleted
18986800,https://catcafebk.com/our-cats/?cat=18986800,Rita Wilde,"2 Years 3 Months "," Female",False,False,False,True,False,True,"Domestic Short Hair ","Rita is the sweetest little baby girl. She loves to play with toys and loves to juggle them around on her own. During the day when she’s sleepy, she likes to lounge on her cat tree and watch ‘cat TV’ out the window. When her foster wakes up in the morning and says her name, Rita will always zoom to the bed and greet her human with soft meows and purrs. Whenever she wants to play, she will walk in front of you and plop down and start rolling around on the floor in the cutest way possible. She’s also really kind towards visitors, greeting them with her cuteness and inviting them to play with her.",2023-02-27 22:49:46+00:00,,,,,,,,,,,,,,True,True,True,True,True,True,True,True,True,True,True,True,True,row_deleted
18384155,https://catcafebk.com/our-cats/?cat=18384155,Rock & Paper,"11 Months 1 Day "," Male",False,True,True,False,True,False,"Domestic Short Hair ","Rock and Paper are a couple of mild mannered siblings whose personalities perfectly complement each other.  They are both very social once they have adjusted to their environment and do not want to miss out on anything going on in the house. Are you working? Paper will supervise from your lap or next to your computer while Rock naps in a box nearby. Are you cooking? Both kitties will play around in the kitchen to keep you company. Are you watching TV? They will happily join you on the couch for snuggles. Rock is curious and courageous once he has adapted to his new environment and will snuggle with you for ages. If you start scratching him behind his ear he will actively push against your hand to show you he wants more. It takes a little longer to win Paper’s trust, but with some bribery (treats) Paper will also be a great snuggle buddy. They love to chase each other around, admire their reflections in the mirror and play with string toys. While they are not huge fans of strangers yet, they are very loving and loyal to people they know.",2023-02-27 22:49:46+00:00,,,,,,,,,,,,,,True,True,True,True,True,True,True,True,True,True,True,True,True,row_deleted
18924644,https://catcafebk.com/our-cats/?cat=18924644,Rye & Swiss,"6 Months 5 Days ",,False,True,True,False,True,False,"Domestic Short Hair ","Sisters Rye and Swiss are energetic and entertaining sweethearts that love to play, purr and snuggle. They want to be a part of your day from beginning to end. Rye (gray tuxedo) will leap high and whip around for colorful streamer toys. When she’s worn out she’ll plop onto whoever is on the couch and purr for pets and chin rubs. Swiss (calico) loves nothing more than inspecting a running bathroom faucet. When held like a baby, she melts and purrs. She is very food motivated, especially if it’s your food, she would like some please, pretty please.",2023-02-27 22:49:46+00:00,,,,,,,,,,,,,,True,True,True,False,True,True,True,True,True,True,True,True,True,row_deleted
19004882,https://catcafebk.com/our-cats/?cat=19004882,Sativa,"2 Years 7 Months "," Female",False,False,True,False,False,False,"Domestic Short Hair ","Sativa is a small cat with a big attitude. She is adventurous and energetic and loves to explore, play, run, jump and climb. She sees everyone as a possible playmate: humans, other cats, and even big dogs. She'd do best in a home where she'll get plenty of playtime and enrichment and where animal housemates won't be overwhelmed by her playful energy. Sativa also has a snuggly side. Once she's tired out, she enjoys curling up for a nap. Sativa is looking for a new home after her previous owner lost his housing. She previously lived with other cats and with a large dog. Her sister Indica is also available for adoption, they can be adopted together or separately, as they are not bonded.",2023-02-27 22:49:46+00:00,,,,,,,,,,,,,,True,True,True,True,True,True,True,True,True,True,True,True,True,row_deleted
18666840,https://catcafebk.com/our-cats/?cat=18666840,Scotty,"5 Years 4 Months "," Male",False,True,False,True,False,True,"Domestic Short Hair ","With dazzling golden eyes and a peaceful disposition, Scotty is a delightful companion with nothing but love to give. This guy loves a good nap and is happiest when he's getting head and chin pets. In between naps and pets, he likes to spend time on his scratch pad. Although he's not sure what to make of catnip, it sure does bring out his party side! If he isn't napping, exploring, by your side, or on his scratch pad, you might find him admiring his reflection in the mirror. Love this guy's confidence! At bedtime, he'll give you a quick goodnight cuddle before settling at your feet for the night. Scotty is super easy going, so if you don't want him in bed, he's likely to happily find another cozy spot. He is around five and would do best as an only cat. He may be ok with older children as long as they are gentle with him.",2023-02-27 22:49:46+00:00,https://catcafebk.com/our-cats/?cat=18666840,Scotty,"5 Years 8 Months "," Male",False,True,False,True,False,True,"Domestic Short Hair ","With dazzling golden eyes and a peaceful disposition, Scotty is a delightful companion with nothing but love to give. This guy loves a good nap and is happiest when he's getting head and chin pets. In between naps and pets, he likes to spend time on his scratch pad. Although he's not sure what to make of catnip, it sure does bring out his party side! If he isn't napping, exploring, by your side, or on his scratch pad, you might find him admiring his reflection in the mirror. Love this guy's confidence! At bedtime, he'll give you a quick goodnight cuddle before settling at your feet for the night. Scotty is super easy going, so if you don't want him in bed, he's likely to happily find another cozy spot. He is around five and would do best as an only cat. He may be ok with older children as long as they are gentle with him. Scotty LOVES human visitors. He quickly comes to greet new guests, making sure everyone has an opportunity to give him pets or play. But Scotty is way too cool to be overbearing--he mostly just wants to chill out where the action is. Scotty is a delightful kitty with so much love to give. He’s social and playful, but earnest in his own hilarious way.",2023-07-08 17:08:34+00:00,False,False,True,False,False,False,False,False,False,False,False,True,True,row_modified
18468089,https://catcafebk.com/our-cats/?cat=18468089,Sebastian,"4 Years 7 Months "," Male",False,False,True,False,False,False,"Domestic Short Hair ","Add some spice to your household with Sebastian! He’s talkative, playful and loves head scratches. While he was initially cautious on arrival in his new foster home, after a few days Sebastian was exploring his new home with great curiosity. Once he has settled in, he is a confident, independent cat, who will rush to the front door to greet you the second you arrive home. He is also comfortable around visitors to the home and asks for pets and head scratches from his foster and strangers alike. Sebastian is good pals with his foster housemate Howard’s End and is eager to engage in playful zoomies and play wrestling with his fellow orange tabby buddy. Whether you’re looking to become a one-cat household or you have an FeLV cat who would like a companion, Sebastian is a cat who can do both if you have a little patience. One thing that might surprise you about Sebastian is his enormous appetite. He behaves around food as if he hasn’t eaten for a month (and won’t eat again for another month) and will try to sniff out and scavenge any food he can find. A counter surfer at heart, he will even eat vegetables you might usually expect cats to turn their noses up at. Peas? Yup! Green beans? Yes please! Once a street cat, always a street cat! Because Sebastian has FeLV, he can only be around other FeLV cats, but he is visibly healthy with no outward signs of FeLV. He will have the best chance at living many more years in a caring home with a proper diet.",2023-02-27 22:49:46+00:00,,,,,,,,,,,,,,True,True,True,True,True,True,True,True,True,True,True,True,True,row_deleted
19015699,https://catcafebk.com/our-cats/?cat=19015699,Serena,," Female",False,False,False,False,False,False,"Domestic Short Hair ","Serena is a super sweet and playful calico girl. She loves pats and will purr like crazy, headbutt for more, and even roll over onto her back for belly scritches! She’s energetic and adores toys of all kinds (especially anything with feathers). She’s always up for interactive play with a wand toy, but also happy to play by herself with her catnip mouse. Serena can be a little shy at first, but is easily won over with scritches and treats. She’s still learning about laps and hasn’t figured out that she can crawl up herself, but in the meantime she’s happy to be placed there for snuggles. Her other hobbies include following her human around the house, watching the washing machine spin (she’s absolutely mesmerized), and rolling around cutely on the floor in hopes of getting pats. Serena is curious and friendly with other cats and needs to be adopted into a home with a playful companion — adoptions for her as a single cat will be ignored.",2023-02-27 22:49:46+00:00,,,,,,,,,,,,,,True,True,False,True,True,True,True,True,True,True,True,True,True,row_deleted
18949220,https://catcafebk.com/our-cats/?cat=18949220,Shallot & Water Chestnut,"4 Months 29 Days "," Female",False,True,True,False,True,False,"Domestic Short Hair ","Shallot, Arrowhead, and Water Chestnut are total and complete goofs. They are little bundles of energy that love to run around and play with each other until they are exhausted, and then they take a long nap piled on top of each other in their cat bed. Shallot is a tabby girl with a white stripe on her face and is definitely the leader of the pack. She loves stuffed mice toys and especially loves the laser pointer. Now and then she gets in a cuddly mood and wants nothing more than to snuggle up to your face. Arrowhead is a tabby wit a white “mountain” pattern on his face. He sometimes still gets jumpy and runs away when he sees his fosters coming, but when he’s feeling brave and they pet him, he starts purring right away. He loves to play with his sisters, and he even likes to cuddle with his humans at night. Water Chestnut is the gray girl. She tends to be a bit calmer than her brother and sister, but when she’s in the mood she’ll play and run around with them too. She’s an expert at finding the coziest looking spots to sleep. If you pick her up she’ll let you hold her for as long as you’ll rub her tummy. These three kittens are sweet, silly, and playful. They’d be great in any home that’s ready to embrace their energy and give them lots of love and attention. They can be adopted as a trio, two of them as a pair, or one of them with another kitten their age. All three are equally friends and will be happy as long as they have a playmate.",2023-02-27 22:49:46+00:00,,,,,,,,,,,,,,True,True,True,True,True,True,True,True,True,True,True,True,True,row_deleted
