cat_id,url_old,cat_name_old,age_old,gender_old,cafe_cat_old,kid_approved_old,dog_approved_old,companion_cat_old,bonded_pair_old,single_cat_old,type_old,description_old,system_import_at_old,url_new,cat_name_new,age_new,gender_new,cafe_cat_new,kid_approved_new,dog_approved_new,companion_cat_new,bonded_pair_new,single_cat_new,type_new,description_new,system_import_at_new,was_url_modified,was_cat_name_modified,was_age_modified,was_gender_modified,was_cafe_cat_modified,was_kid_approved_modified,was_dog_approved_modified,was_companion_cat_modified,was_bonded_pair_modified,was_single_cat_modified,was_type_modified,was_description_modified,was_modified,change_type
18950812,https://catcafebk.com/our-cats/?cat=18950812,Pajamas,"1 Year 2 Months "," Female",False,False,False,True,False,True,"Domestic Short Hair ","Pajamas is a sweet and shy girl who is slowly coming out of her shell. This dainty girl loves to play and makes a good office buddy while working. She does need her personal space, but is gradually showing more and more curiosity about engaging with her foster human. She is a great eater and treats are a fabulous way to her heart. Pajamas especially enjoys cozy nooks, Churus, and getting toys stuck under furniture so they’re more of a challenge. She would likely be perfectly happy as your one and only cat, but she also does not appear to be bothered by other cats and interacting with her foster sister is helping her to open up. It is a joy to see her grow increasingly more comfortable being inside with people.",2023-01-22 19:13:48+00:00,https://catcafebk.com/our-cats/?cat=18950812,Pajamas,"1 Year 3 Months "," Female",False,False,False,True,False,True,"Domestic Short Hair ","Pajamas is a sweet and shy girl who is slowly coming out of her shell. This dainty girl loves to play and makes a good office buddy while working. She does need her personal space, but is gradually showing more and more curiosity about engaging with her foster human. She is a great eater and treats are a fabulous way to her heart. Pajamas especially enjoys cozy nooks, Churus, and getting toys stuck under furniture so they’re more of a challenge. She would likely be perfectly happy as your one and only cat, but she also does not appear to be bothered by other cats and interacting with her foster sister is helping her to open up. It is a joy to see her grow increasingly more comfortable being inside with people.",2023-02-27 22:49:46+00:00,False,False,True,False,False,False,False,False,False,False,False,False,True,row_modified
18844513,https://catcafebk.com/our-cats/?cat=18844513,Pam,"2 Years 4 Months "," Female",False,False,False,True,False,True,"Domestic Short Hair ","Sweet like jam, is Pam, a gentle soul and is a sucker for a chin scratches. Living with her sister wife partner outdoors, Pam tended to a family of kittens before being rescued. Not a fan of change, Pam took a few weeks to feel comfortable wandering in the presence of her foster mom. She now lurks in doorways for meal times, plays with stray office supplies, and basks in the sunlight on top the bed. She enjoys pets when lured by treats into reach, but also accepts pets easily when sleepy in her comfy bed. She loves to play hard to get, and has been spotting playing with toys late at night when she thinks no one is watching. She has also recently been joined by a young visitor who has shown Pam the world is not as scary as she thinks. Pam is looking for a quiet, patient forever home where she can be her quirky self and continue to come out of her furry shell.",2023-01-22 19:13:48+00:00,https://catcafebk.com/our-cats/?cat=18844513,Pam,"2 Years 5 Months "," Female",False,False,False,True,False,True,"Domestic Short Hair ","Sweet like jam, Pam is a cute, quiet, cautious little babe. She spends her days loafing in various locations: beds and couches and closets, oh my! Once you can get close enough for a pet or a snuggle, she’s a sucker for a chin scratch. When the floodgates open, she’s a purr machine, prancing back and forth and rubbing nearby furniture to ask for more loves. She tends to play hard to get, and has been spotted playing with toys late at night when she thinks no one is watching. She has quite the squeaky meow (which feels appropriate), and will call to you at meal times and prance nearby till she is served. She is easily startled and has a strong aversion to the sound of running water (goofy) — but she is also a master of forgiveness and is easily tempted by all varieties of treats. Simply, Pam is a gentle soul. Her story began when she was found living with her sister wife partner outdoors tending to a family of kittens. When she was rescued and relieved of her motherly duties, Pam had a big sigh of relief. Pam is looking for a quiet, patient forever home where she can hit snooze, over, and over. Find more videos and photos of Pam in her foster home on Instagram: @crownstreetfosters.",2023-02-27 22:49:46+00:00,False,False,True,False,False,False,False,False,False,False,False,True,True,row_modified
17952492,https://catcafebk.com/our-cats/?cat=17952492,Papa Watkins Riverdale,"9 Years 11 Months "," Male",False,False,False,True,False,True,"Domestic Short Hair ","Sometimes the best things are worth the wait – and sweet Papa Watkins is a great example. Sick and scared when he first went to foster, this guy slowly and surely became healthier and started to blossom into a more confident companion. He now LOVES head pets and scritches and seeks out attention from his foster parents, no longer running and hiding when he’s scared.. Papa Watkins is a champion napper and eater and will never say no to a pet or treat. He loves to chase balls around the apartment and he’s developed an adorable tendency to drool when he’s super content. His newest way of asking for attention is to lay down at your feet, placing a paw or his head directly on your foot just to say he’s there. This sweetheart needs a home where his new family can spoil him with love and attention. Papa Watkins had been living in a slightly managed outdoor colony for a couple of years, but was always too busy fighting or hanging with the lady cats to go into a trap, until one bitter cold night when he was scavenging through recycling and hungry enough to get rescued. Papa Watkins is FIV+ and will live a normal, healthy life when provided with quality care such as a balanced diet and yearly wellness exams (like any cat). As FIV+ is not transmittable between neutered/spayed cats under normal circumstances, we are happy for FIV+ cats to mingle with FIV- cats in their adoptive homes.",2023-01-22 19:13:48+00:00,https://catcafebk.com/our-cats/?cat=17952492,Papa Watkins Riverdale,"10 Years 0 Months "," Male",False,False,False,True,False,True,"Domestic Short Hair ","Sometimes the best things are worth the wait – and sweet Papa Watkins is a great example. Sick and scared when he first went to foster, this guy slowly and surely became healthier and started to blossom into a more confident companion. He now LOVES head pets and scritches and seeks out attention from his foster parents, no longer running and hiding when he’s scared.. Papa Watkins is a champion napper and eater and will never say no to a pet or treat. He loves to chase balls around the apartment and he’s developed an adorable tendency to drool when he’s super content. His newest way of asking for attention is to lay down at your feet, placing a paw or his head directly on your foot just to say he’s there. This sweetheart needs a home where his new family can spoil him with love and attention. Papa Watkins had been living in a slightly managed outdoor colony for a couple of years, but was always too busy fighting or hanging with the lady cats to go into a trap, until one bitter cold night when he was scavenging through recycling and hungry enough to get rescued. Papa Watkins is FIV+ and will live a normal, healthy life when provided with quality care such as a balanced diet and yearly wellness exams (like any cat). As FIV+ is not transmittable between neutered/spayed cats under normal circumstances, we are happy for FIV+ cats to mingle with FIV- cats in their adoptive homes.",2023-02-27 22:49:46+00:00,False,False,True,False,False,False,False,False,False,False,False,False,True,row_modified
18950699,https://catcafebk.com/our-cats/?cat=18950699,Parfum,"8 Years 1 Month "," Male",False,True,False,True,False,True,"Domestic Short Hair ","Parfum is the sweetest cat and all he wants is to be loved! He started having full conversations with his foster on his drive home and hasn’t stopped since. This oh so sweet boy loves belly rubs (his sweet spot), chin scritches and being held like a baby and is so affectionate he doesn’t mind being smothered in kisses. He will get into your lap every once in a while, but most of the time he is glad to just be by your side, especially when sleeping. He is a very active and busy biscuit maker and spends the rest of his time meowing for attention, asking for treats or snoozing in a comfy spot. Parfum is in need of dental surgery.",2023-01-22 19:13:48+00:00,https://catcafebk.com/our-cats/?cat=18950699,Parfum,"8 Years 2 Months "," Male",False,True,False,True,False,True,"Domestic Short Hair ","Parfum is the sweetest cat and all he wants is to be loved! He started having full conversations with his foster on his drive home and hasn’t stopped since. This oh so sweet boy loves belly rubs (his sweet spot), chin scritches and being held like a baby and is so affectionate he doesn’t mind being smothered in kisses. He will get into your lap every once in a while, but most of the time he is glad to just be by your side, especially when sleeping. He is a very active and busy biscuit maker and spends the rest of his time meowing for attention, asking for treats or snoozing in a comfy spot. Parfum is in need of dental surgery.",2023-02-27 22:49:46+00:00,False,False,True,False,False,False,False,False,False,False,False,False,True,row_modified
18435719,https://catcafebk.com/our-cats/?cat=18435719,Paste & Undo,"9 Months 10 Days "," Male",False,True,True,False,True,False,"Domestic Short Hair ","Undo and Paste are a pair of lively and sweet brothers. These two initially shy boys have become quite snuggly and vocal as their appetites and demands continue to grow. They both very much enjoy surrounding themselves with toys and stalking and pouncing on each other through a kitty tunnel. These boys enjoy pets, scritches, and belly rubs. They have begun to socialize and love to follow around the resident cats. Undo and Paste enjoy snuggling and giving kisses to their foster parents, especially first thing in the morning - you can tell they are happy to see you. These heartbreakers are adorable and fun and so playful - a constant heart explosion.",2023-01-22 19:13:48+00:00,https://catcafebk.com/our-cats/?cat=18435719,Paste & Undo,"10 Months 15 Days "," Male",True,True,True,False,True,False,"Domestic Short Hair ","Undo and Paste are a pair of lively and sweet brothers. These two initially shy boys have become quite snuggly and vocal as their appetites and demands continue to grow. They both very much enjoy surrounding themselves with toys and stalking and pouncing on each other through a kitty tunnel. These boys enjoy pets, scritches, and belly rubs. They have begun to socialize and love to follow around the resident cats. Undo and Paste enjoy snuggling and giving kisses to their foster parents, especially first thing in the morning - you can tell they are happy to see you. These heartbreakers are adorable and fun and so playful - a constant heart explosion.",2023-02-27 22:49:46+00:00,False,False,True,False,True,False,False,False,False,False,False,False,True,row_modified
18110978,https://catcafebk.com/our-cats/?cat=18110978,Peaberry,"3 Years 7 Months "," Female",False,False,False,True,False,True,"Domestic Short Hair ","Peaberry is a chatty, chirpy young lady who adores pets. She is a polite house guest who only scratches the scratching items provided and spends plenty of her time napping. She is occasionally playful, especially if it’s initiated with the toss of a ball or wave of a wand.  She enjoys sitting on laps or right next to them if there is room and will follow you around quietly. After some pre-bed cuddles she will happily sleep at your feet for the whole night. Peaberry was found outside of a semi-managed colony and it is presumed that she was recently dumped. She’s a calm and affectionate companion and she would love to tell you her whole story herself when she meets you -- however, she knows to stay quiet and out of the way if you are working from home. Peaberry was rescued with severe dental disease and is in need of surgery. We are hoping that her adopters can help us cover the cost or assist with crowdsourcing for this necessary treatment.",2023-01-22 19:13:48+00:00,,,,,,,,,,,,,,True,True,True,True,True,True,True,True,True,True,True,True,True,row_deleted
17539613,https://catcafebk.com/our-cats/?cat=17539613,Petra & Paula,"1 Year 8 Months "," Female",False,True,False,False,True,False,"Domestic Short Hair (short coat) ","Petra and Paula are nearly identical 6 month old tuxedo sisters! They were rescued with a third sibling in the Sheepshead Bay area, where these three kittens were trying to survive in the back of a medical office, hiding under the porch. They are healthy, playful and moderately active. They both love to be around people and to play with each other and other cats. They are spayed, free from parasites, , vaccinated, tested negative for FIV/FeLV and microchipped. Petra and Paula must be adopted together. They are being fostered in Midwood and their rescuer can arrange either a video or in person meeting. *Courtesy Posting: This cat is being independently offered for adoption by a rescuer who is not a representative of BBAWC or Brooklyn Cat Cafe. The rescuer offering this cat is responsible for the content of this post and any medical records and vaccines. BBAWC and Brooklyn Cat Cafe cannot vouch for any information in this post. An adoption fee will be charged by the rescuer.",2023-01-22 19:13:48+00:00,https://catcafebk.com/our-cats/?cat=17539613,Petra & Paula,"1 Year 9 Months "," Female",False,True,False,False,True,False,"Domestic Short Hair (short coat) ","Petra and Paula are nearly identical 6 month old tuxedo sisters! They were rescued with a third sibling in the Sheepshead Bay area, where these three kittens were trying to survive in the back of a medical office, hiding under the porch. They are healthy, playful and moderately active. They both love to be around people and to play with each other and other cats. They are spayed, free from parasites, , vaccinated, tested negative for FIV/FeLV and microchipped. Petra and Paula must be adopted together. They are being fostered in Midwood and their rescuer can arrange either a video or in person meeting. *Courtesy Posting: This cat is being independently offered for adoption by a rescuer who is not a representative of BBAWC or Brooklyn Cat Cafe. The rescuer offering this cat is responsible for the content of this post and any medical records and vaccines. BBAWC and Brooklyn Cat Cafe cannot vouch for any information in this post. An adoption fee will be charged by the rescuer.",2023-02-27 22:49:46+00:00,False,False,True,False,False,False,False,False,False,False,False,False,True,row_modified
18849443,https://catcafebk.com/our-cats/?cat=18849443,Pheasant & Crescent Pleasant,"6 Months 10 Days "," Male",False,True,True,True,True,True,"Domestic Short Hair ","Crescent and Pheasant are the most adorable, sweet, and well-mannered brothers you could ask for. Their personalities are perfectly matched for each other, and they can often be found playing with or napping on top of each other. Pheasant is a gray and white boy who will come right up to you if you snap your fingers together and will start purring like a power drill as soon as you start petting him. He is a professional ribbon hunter in training and is extremely focused on getting all of the toys under his control. Crescent, a white and brown tabby, may take a little longer to warm up, but once a few treat offerings are made, he will happily be purring on your lap. He has a sophisticated palate and will clearly let the chef know of his orders with the cutest meows during meal times.",2023-01-22 19:13:48+00:00,,,,,,,,,,,,,,True,True,True,True,True,True,True,True,True,True,True,True,True,row_deleted
17041959,https://catcafebk.com/our-cats/?cat=17041959,Pink & Poo,"2 Years 1 Month "," Female",False,True,True,False,True,False,"Domestic Short Hair ","Poo and Pink, family name Bear, are very affectionate and energetic sisters. Poo is very outgoing and loves to make new friends. She is larger and lankier and will hurl herself, purring, to cuddle and play. Pink is a bit more reserved (and perhaps somewhat smarter), but is always up for a game — especially with any toy that has feathers. These sweet girls were surrendered to the city shelter from a home with two many animals. They have very sensitive stomachs, but we’ve finally found the perfect diet to keep them full and healthy.",2023-01-22 19:13:48+00:00,,,,,,,,,,,,,,True,True,True,True,True,True,True,True,True,True,True,True,True,row_deleted
18495077,https://catcafebk.com/our-cats/?cat=18495077,Plum & Floyd Collins,"6 Months 25 Days ",,False,True,True,False,True,False,"Domestic Short Hair ","These two goobers are in classic kitten cahoots in every way! Floyd Collins (black and white cat) takes on the role of elder brother, starting antics and pouncing on toy prey, and Plum (black cat) is always scrambling to get her feet under her and follow wherever her little sister paws can take her. Squeaks and mews abound as these darling kittens tucker themselves out, and then, once they do, they're happy to curl up in a cozy kitten pile wherever they can find. Floyd is incredibly snuggly and curious. While Plum is a playful explorer always up to climb her scratching post and explore the upper reaches of your shoulders. Long story short, this pair of kittens have come so far from surviving their birth on a grocery store roof, and they can't wait to bound across your apartment and straight into your heart.",2023-01-22 19:13:48+00:00,,,,,,,,,,,,,,True,True,True,False,True,True,True,True,True,True,True,True,True,row_deleted
18928047,https://catcafebk.com/our-cats/?cat=18928047,Princey,"9 Years 1 Month "," Male",True,True,True,True,False,True,"Domestic Short Hair ","Princey is very affectionate cat and loves pets, head scritches and snuggles. He has loads of curiosity and loves to stare out the window at night and investigate. He will cuddle up next to you as long as you pet him and he makes the perfect work companion. Princey can be adopted as a single cat or as a cat companion. He is in need of dental surgery.",2023-01-22 19:13:48+00:00,https://catcafebk.com/our-cats/?cat=18928047,Princey,"9 Years 2 Months "," Male",False,True,True,True,False,True,"Domestic Short Hair ","Princey is a very affectionate cat and loves to cuddle up any time of the day. He expresses his wonderful vocals at night, and it is the most adorable sound you will ever hear! He is shy at first, but he does not hide. He loves pets and scratches on his head and warms up in a couple hours. Even though he is not very energetic, he has loads of curiosity. Whenever a door opens, he is the first one to hear it and will investigate immediately. He loves to stare out the window at night and check out what is going on and will cuddle up next to you as long as you pet him. His love language is definitely physical touch and he makes the perfect work companion.",2023-02-27 22:49:46+00:00,False,False,True,False,True,False,False,False,False,False,False,True,True,row_modified
18849368,https://catcafebk.com/our-cats/?cat=18849368,Quip & Remsen,"6 Months 6 Days ",,False,False,True,False,True,False,"Domestic Short Hair ","Quip is a high-energy firecracker. She is inquisitive, athletic, and will chase any toy you throw at her. Expect a nightly case of the zoomies and overall playfulness that will keep you enchanted. She definitely requires a keen eye, as she’s known to get into trouble and has a feisty side. When she’s not in daredevil mode, she is absurdly affectionate. She will climb all over you in the middle of your work, sleep, whenever. She loves to make biscuits and curl up on people’s necks, so expect a good cuddling when she’s tired out. Bonus: she feels like a cloud, will the softest, prettiest fur ever. She can be a bit rough when playing with other cats, so make sure you watch her carefully and can deter any aggressiveness. Remsen is more reserved than his BFF, but definitely has some of that kitten energy. He is super affectionate but may take longer to open up. His face resembles a mini tiger, and he has a gorgeous, thick, and warm tabby coat. Remsen is a little genius cat, who loves finding hidden treats and discovering whatever climbing spots you have. He adores treats andhis favorite time is meal-time. In between waiting for dinner and lunch, he's typically cozied up on a pillow or next to the window watching TV or people.",2023-01-22 19:13:48+00:00,https://catcafebk.com/our-cats/?cat=18849368,Quip & Remsen,"7 Months 11 Days ",,False,False,True,False,True,False,"Domestic Short Hair ","Quip is a high-energy firecracker. She is inquisitive, athletic, and will chase any toy you throw at her. Expect a nightly case of the zoomies and overall playfulness that will keep you enchanted. She definitely requires a keen eye, as she’s known to get into trouble and has a feisty side. When she’s not in daredevil mode, she is absurdly affectionate. She will climb all over you in the middle of your work, sleep, whenever. She loves to make biscuits and curl up on people’s necks, so expect a good cuddling when she’s tired out. Bonus: she feels like a cloud, will the softest, prettiest fur ever. She can be a bit rough when playing with other cats, so make sure you watch her carefully and can deter any aggressiveness. Remsen is more reserved than his BFF, but definitely has some of that kitten energy. He is super affectionate but may take longer to open up. His face resembles a mini tiger, and he has a gorgeous, thick, and warm tabby coat. Remsen is a little genius cat, who loves finding hidden treats and discovering whatever climbing spots you have. He adores treats andhis favorite time is meal-time. In between waiting for dinner and lunch, he's typically cozied up on a pillow or next to the window watching TV or people.",2023-02-27 22:49:46+00:00,False,False,True,False,False,False,False,False,False,False,False,False,True,row_modified
18948885,https://catcafebk.com/our-cats/?cat=18948885,Ray & Egon,"4 Months 24 Days ",,False,False,False,False,True,False,"Domestic Short Hair ","Ray and Egon are two adorable lap cats. Ray (tuxedo) loves sleeping on his foster lap and curling up next to his foster dad. His purr motor is always on. Egon (brown tabby) is a bit shyer, but loves to play. These two kittens love to run around, chase laser dots and keeping their fosters safe from the blanket monster.",2023-01-22 19:13:48+00:00,https://catcafebk.com/our-cats/?cat=18948885,Ray & Egon,"5 Months 29 Days ",,True,True,True,False,True,False,"Domestic Short Hair ","Ray and Egon are two adorable lap cats. Ray (tuxedo) loves sleeping on his foster lap and curling up next to his foster dad. His purr motor is always on. Egon (brown tabby) is a bit shyer, but loves to play. These two kittens love to run around, chase laser dots and keeping their fosters safe from the blanket monster.",2023-02-27 22:49:46+00:00,False,False,True,False,True,True,True,False,False,False,False,False,True,row_modified
18961091,https://catcafebk.com/our-cats/?cat=18961091,Rifi & Roxi,"4 Years 8 Months "," Female",False,False,False,False,True,False,"Domestic Short Hair ","Roxi and Rifi are incredibly sweet four year old cats who are looking for a new home after a relative with a cat allergy moved in. They both love sitting on window sills and watching the world pass by outside, and will climb up to the highest spot in any room to look over their home. Both cats are more than happy to get scritches and will both come right up to you and force their way under your hand. Although generally pretty mellow, if you wave toys at them, they will happily swing their heads in unison and follow it with their eyes. They love eating treats straight from your hand and are incredibly gentle! Both cats are perfectly content with being in the same room with many people, and don't get overwhelmed too easily. They can tolerate being pet by children, but get startled somewhat easily around loud noises. Both cats have heart murmurs, neither of which need medication.",2023-01-22 19:13:48+00:00,,,,,,,,,,,,,,True,True,True,True,True,True,True,True,True,True,True,True,True,row_deleted
